{
  "semantic": "pems/1",
  "project_id": "project:gdscript-voxel-terrain",
  "records": [
    {"id":"adjustment:architecture:offline-runtime-boundary","kind":"architecture_adjustment","lifecycle":"current","observation_refs":["observation:adr-offline-runtime:a1"],"data":{"summary":"Keep terrain generation offline and runtime focused on precomputed asset residency.","adjustment_state":"accepted","authority_target":"source:adr-offline-runtime"}},
    {"id":"adjustment:roadmap:resource-loading-before-lod","kind":"roadmap_adjustment","lifecycle":"current","observation_refs":["observation:roadmap:r2"],"data":{"summary":"Prioritize resource loading before LOD.","adjustment_state":"accepted","authority_target":"source:roadmap"}},
    {"id":"branch:project-chat-handoff","kind":"branch","lifecycle":"current","observation_refs":["observation:branch-handoff:b1"],"data":{"repository":"loteque/gdscript-voxel-engine","name":"project-chat-handoff","head_commit":"8d28ac56eec607c1823bd59d0810a8edb1d38a30"}},
    {"id":"chat:architecture-governance","kind":"chat","lifecycle":"current","observation_refs":["observation:handoff:h1"],"data":{"project_id":"project:gdscript-voxel-terrain","title":"Procedural Terrain Architecture","summary":"Architecture governance and continuity work.","started_at":"2026-08-06T00:00:00-07:00","ended_at":null,"active_role_id":"role:engineering-knowledge-systems-architect"}},
    {"id":"chat:streaming-validation","kind":"chat","lifecycle":"historical","observation_refs":["observation:handoff:h1"],"data":{"project_id":"project:gdscript-voxel-terrain","title":"Chunk Residency Implementation","summary":"Runtime residency and validation work.","started_at":"2026-08-10T00:00:00-07:00"}},
    {"id":"column:memory-events:semantic-id","kind":"database_column","lifecycle":"current","observation_refs":["observation:owner-policy:o1"],"data":{"table_id":"table:memory-events","name":"semantic_id","data_type":"text","nullable":false}},
    {"id":"continuation:architecture-governance","kind":"continuation","lifecycle":"current","observation_refs":["observation:owner-policy:o1"],"data":{"chat_id":"chat:architecture-governance","active_role_id":"role:engineering-knowledge-systems-architect","current_focus":"Implement frozen PEMS v1 Phase 1 schemas and fixtures.","blocker_ids":[],"pending_owner_decision_ids":[],"high_value_record_ids":["decision:pems-design-freeze","requirement:preserve-history","source:steward-notes"]}},
    {"id":"decision:canonical-path-old","kind":"decision","lifecycle":"superseded","observation_refs":["observation:owner-policy:o1"],"superseded_by":["decision:canonical-path-new"],"data":{"summary":"Keep only the human JSON path after migration.","decision_state":"superseded","rationale":null}},
    {"id":"decision:canonical-path-new","kind":"decision","lifecycle":"current","observation_refs":["observation:owner-policy:o1"],"supersedes":["decision:canonical-path-old"],"data":{"summary":"Use docs/project-chat-handoff.cove.json as intended post-migration canonical compact path while retaining the human JSON derivative.","decision_state":"accepted","rationale":"Separates compact canonical storage from deterministic human compatibility output."}},
    {"id":"decision:pems-design-freeze","kind":"decision","lifecycle":"current","observation_refs":["observation:steward-notes:s3"],"data":{"summary":"Freeze PEMS v1 / COVE v1 design for implementation.","decision_state":"accepted"}},
    {"id":"decision:proposed-extension-policy","kind":"decision","lifecycle":"historical","observation_refs":["observation:steward-notes:s3"],"data":{"summary":"Permit project-local record extensions in pems/1.","decision_state":"rejected","rationale":"The v1 vocabulary remains closed until evidence justifies extensions."}},
    {"id":"env:docs-mode","kind":"environment_variable","lifecycle":"current","observation_refs":["observation:owner-policy:o1"],"data":{"name":"DOCS_MODE","value_state":"literal","value":"strict","external_ref":null,"purpose":"Example intentionally non-secret durable configuration."}},
    {"id":"env:example-token","kind":"environment_variable","lifecycle":"current","observation_refs":["observation:owner-policy:o1"],"data":{"name":"EXAMPLE_TOKEN","value_state":"external_secret","value":null,"external_ref":"secret-store:example-token","purpose":"Example secret-safe disposition without a credential value."}},
    {"id":"expectation:verify-current-repository","kind":"expectation","lifecycle":"current","observation_refs":["observation:owner-policy:o1"],"data":{"summary":"Verify current repository truth before making operational claims.","expectation_state":"active"}},
    {"id":"external-file:asteroid-progress","kind":"external_file","lifecycle":"historical","observation_refs":["observation:handoff:h1"],"data":{"name":"Asteroid Generation Progress.txt","purpose":"Historical project-context input."}},
    {"id":"module:chunk-streamer","kind":"module","lifecycle":"current","observation_refs":["observation:main:m1"],"data":{"name":"ChunkStreamer","path":"voxel/chunking/ChunkStreamer.gd","domain":"chunking/runtime","public_role":"Loads and manages residency of precomputed terrain chunks."}},
    {"id":"module:point-field-resource","kind":"module","lifecycle":"current","observation_refs":["observation:main:m1"],"data":{"name":"PointFieldResource","path":"voxel/field/PointFieldResource.gd","domain":"field","public_role":"Authoritative regular-lattice scalar-field representation."}},
    {"id":"observation:adr-offline-runtime:a1","kind":"source_observation","lifecycle":"historical","observation_refs":[],"data":{"source_id":"source:adr-offline-runtime","evidence_state":"immutable_snapshot","observed_at":"2026-08-13T15:00:00-07:00","evidence_locator":{"repository":"loteque/gdscript-voxel-engine","commit":"abc123","path":"docs/architecture/decisions/ADR-001-offline-runtime-terrain-boundary.md"},"captured_fingerprint":null}},
    {"id":"observation:branch-handoff:b1","kind":"source_observation","lifecycle":"historical","observation_refs":[],"data":{"source_id":"source:branch-handoff","evidence_state":"immutable_snapshot","observed_at":"2026-08-13T16:35:00-07:00","evidence_locator":{"repository":"loteque/gdscript-voxel-engine","commit":"8d28ac56eec607c1823bd59d0810a8edb1d38a30"}}},
    {"id":"observation:handoff:h1","kind":"source_observation","lifecycle":"historical","observation_refs":[],"data":{"source_id":"source:handoff","evidence_state":"immutable_snapshot","observed_at":"2026-08-13T13:08:00-07:00","evidence_locator":{"repository":"loteque/gdscript-voxel-engine","commit":"1f72f8d61e0799cf94a5dedb3953d533068bf502","path":"docs/project-chat-handoff.json"}}},
    {"id":"observation:main:m1","kind":"source_observation","lifecycle":"historical","observation_refs":[],"data":{"source_id":"source:main","evidence_state":"immutable_snapshot","observed_at":"2026-08-13T13:08:00-07:00","evidence_locator":{"repository":"loteque/gdscript-voxel-engine","commit":"1f72f8d61e0799cf94a5dedb3953d533068bf502"}}},
    {"id":"observation:owner-policy:o1","kind":"source_observation","lifecycle":"historical","observation_refs":[],"data":{"source_id":"source:owner-policy","evidence_state":"owner_attestation","observed_at":"2026-08-13T16:33:00-07:00","evidence_locator":{"owner_instruction_id":"owner:pems-v1-freeze"}}},
    {"id":"observation:roadmap:r1","kind":"source_observation","lifecycle":"historical","observation_refs":[],"data":{"source_id":"source:roadmap","evidence_state":"immutable_snapshot","observed_at":"2026-08-11T12:00:00-07:00","evidence_locator":{"repository":"loteque/gdscript-voxel-engine","commit":"roadmap-old","path":"ROADMAP.md"}}},
    {"id":"observation:roadmap:r2","kind":"source_observation","lifecycle":"current","observation_refs":[],"data":{"source_id":"source:roadmap","evidence_state":"immutable_snapshot","observed_at":"2026-08-13T13:08:00-07:00","evidence_locator":{"repository":"loteque/gdscript-voxel-engine","commit":"1f72f8d61e0799cf94a5dedb3953d533068bf502","path":"ROADMAP.md"}}},
    {"id":"observation:steward-notes:s3","kind":"source_observation","lifecycle":"current","observation_refs":[],"data":{"source_id":"source:steward-notes","evidence_state":"immutable_snapshot","observed_at":"2026-08-13T16:35:00-07:00","evidence_locator":{"repository":"loteque/gdscript-voxel-engine","commit":"8d28ac56eec607c1823bd59d0810a8edb1d38a30","path":"docs/handoff/steward_notes.md","note_id":"STEWARD-20260813-003"}}},
    {"id":"observation:unversioned:external-context","kind":"source_observation","lifecycle":"historical","observation_refs":[],"data":{"source_id":"source:external-context","evidence_state":"unversioned_observation","observed_at":"2026-08-13T12:00:00-07:00","evidence_locator":{"artifact_path":"Asteroid Generation Progress.txt"}}},
    {"id":"project:gdscript-voxel-terrain","kind":"project","lifecycle":"current","observation_refs":["observation:handoff:h1"],"data":{"name":"GDScript Voxel Terrain","repository":"loteque/gdscript-voxel-engine","summary":"Godot 4 procedural voxel terrain engine with offline generation and runtime streaming."}},
    {"id":"pull-request:43","kind":"pull_request","lifecycle":"historical","observation_refs":["observation:handoff:h1"],"data":{"repository":"loteque/gdscript-voxel-engine","number":"43","title":"Chunk residency milestone","pull_request_state":"merged","head_branch_id":null}},
    {"id":"requirement:preserve-history","kind":"requirement","lifecycle":"current","observation_refs":["observation:steward-notes:s3"],"data":{"summary":"Ordinary pems/1 normalization preserves historical, superseded, tombstoned, and observation records.","requirement_state":"active"}},